{
  "schema_version": 2,
  "id": "quant-software",
  "name": "Quant Software",
  "description": "A fifteen-problem set for quant software engineering interview preparation.",
  "members": [
    {
      "ordinal": 1,
      "problem_slug": "time-based-key-value-store"
    },
    {
      "ordinal": 2,
      "problem_slug": "insert-delete-getrandom-o1"
    },
    {
      "ordinal": 3,
      "problem_slug": "number-of-islands"
    },
    {
      "ordinal": 4,
      "problem_slug": "insert-interval"
    },
    {
      "ordinal": 5,
      "problem_slug": "find-median-from-data-stream"
    },
    {
      "ordinal": 6,
      "problem_slug": "design-add-and-search-words-data-structure"
    },
    {
      "ordinal": 7,
      "problem_slug": "design-hit-counter"
    },
    {
      "ordinal": 8,
      "problem_slug": "accounts-merge"
    },
    {
      "ordinal": 9,
      "problem_slug": "lru-cache"
    },
    {
      "ordinal": 10,
      "problem_slug": "kth-largest-element-in-a-stream"
    },
    {
      "ordinal": 11,
      "problem_slug": "search-in-rotated-sorted-array"
    },
    {
      "ordinal": 12,
      "problem_slug": "construct-binary-tree-from-preorder-and-inorder-traversal"
    },
    {
      "ordinal": 13,
      "problem_slug": "graph-valid-tree"
    },
    {
      "ordinal": 14,
      "problem_slug": "longest-substring-without-repeating-characters"
    },
    {
      "ordinal": 15,
      "problem_slug": "merge-intervals"
    }
  ]
}
