{
  "schema_version": 2,
  "id": "blind75",
  "name": "Blind 75",
  "description": "NeetCode’s current Blind 75 problem set.",
  "members": [
    {
      "ordinal": 1,
      "problem_slug": "best-time-to-buy-and-sell-stock"
    },
    {
      "ordinal": 2,
      "problem_slug": "climbing-stairs"
    },
    {
      "ordinal": 3,
      "problem_slug": "contains-duplicate"
    },
    {
      "ordinal": 4,
      "problem_slug": "counting-bits"
    },
    {
      "ordinal": 5,
      "problem_slug": "invert-binary-tree"
    },
    {
      "ordinal": 6,
      "problem_slug": "linked-list-cycle"
    },
    {
      "ordinal": 7,
      "problem_slug": "maximum-depth-of-binary-tree"
    },
    {
      "ordinal": 8,
      "problem_slug": "meeting-rooms"
    },
    {
      "ordinal": 9,
      "problem_slug": "merge-two-sorted-lists"
    },
    {
      "ordinal": 10,
      "problem_slug": "missing-number"
    },
    {
      "ordinal": 11,
      "problem_slug": "number-of-1-bits"
    },
    {
      "ordinal": 12,
      "problem_slug": "reverse-bits"
    },
    {
      "ordinal": 13,
      "problem_slug": "reverse-linked-list"
    },
    {
      "ordinal": 14,
      "problem_slug": "same-tree"
    },
    {
      "ordinal": 15,
      "problem_slug": "subtree-of-another-tree"
    },
    {
      "ordinal": 16,
      "problem_slug": "two-sum"
    },
    {
      "ordinal": 17,
      "problem_slug": "valid-anagram"
    },
    {
      "ordinal": 18,
      "problem_slug": "valid-palindrome"
    },
    {
      "ordinal": 19,
      "problem_slug": "valid-parentheses"
    },
    {
      "ordinal": 20,
      "problem_slug": "3sum"
    },
    {
      "ordinal": 21,
      "problem_slug": "binary-tree-level-order-traversal"
    },
    {
      "ordinal": 22,
      "problem_slug": "clone-graph"
    },
    {
      "ordinal": 23,
      "problem_slug": "coin-change"
    },
    {
      "ordinal": 24,
      "problem_slug": "combination-sum"
    },
    {
      "ordinal": 25,
      "problem_slug": "construct-binary-tree-from-preorder-and-inorder-traversal"
    },
    {
      "ordinal": 26,
      "problem_slug": "container-with-most-water"
    },
    {
      "ordinal": 27,
      "problem_slug": "course-schedule"
    },
    {
      "ordinal": 28,
      "problem_slug": "decode-ways"
    },
    {
      "ordinal": 29,
      "problem_slug": "design-add-and-search-words-data-structure"
    },
    {
      "ordinal": 30,
      "problem_slug": "encode-and-decode-strings"
    },
    {
      "ordinal": 31,
      "problem_slug": "find-minimum-in-rotated-sorted-array"
    },
    {
      "ordinal": 32,
      "problem_slug": "graph-valid-tree"
    },
    {
      "ordinal": 33,
      "problem_slug": "group-anagrams"
    },
    {
      "ordinal": 34,
      "problem_slug": "house-robber"
    },
    {
      "ordinal": 35,
      "problem_slug": "house-robber-ii"
    },
    {
      "ordinal": 36,
      "problem_slug": "implement-trie-prefix-tree"
    },
    {
      "ordinal": 37,
      "problem_slug": "insert-interval"
    },
    {
      "ordinal": 38,
      "problem_slug": "jump-game"
    },
    {
      "ordinal": 39,
      "problem_slug": "kth-smallest-element-in-a-bst"
    },
    {
      "ordinal": 40,
      "problem_slug": "longest-common-subsequence"
    },
    {
      "ordinal": 41,
      "problem_slug": "longest-consecutive-sequence"
    },
    {
      "ordinal": 42,
      "problem_slug": "longest-increasing-subsequence"
    },
    {
      "ordinal": 43,
      "problem_slug": "longest-palindromic-substring"
    },
    {
      "ordinal": 44,
      "problem_slug": "longest-repeating-character-replacement"
    },
    {
      "ordinal": 45,
      "problem_slug": "longest-substring-without-repeating-characters"
    },
    {
      "ordinal": 46,
      "problem_slug": "lowest-common-ancestor-of-a-binary-search-tree"
    },
    {
      "ordinal": 47,
      "problem_slug": "maximum-product-subarray"
    },
    {
      "ordinal": 48,
      "problem_slug": "maximum-subarray"
    },
    {
      "ordinal": 49,
      "problem_slug": "meeting-rooms-ii"
    },
    {
      "ordinal": 50,
      "problem_slug": "merge-intervals"
    },
    {
      "ordinal": 51,
      "problem_slug": "non-overlapping-intervals"
    },
    {
      "ordinal": 52,
      "problem_slug": "number-of-connected-components-in-an-undirected-graph"
    },
    {
      "ordinal": 53,
      "problem_slug": "number-of-islands"
    },
    {
      "ordinal": 54,
      "problem_slug": "pacific-atlantic-water-flow"
    },
    {
      "ordinal": 55,
      "problem_slug": "palindromic-substrings"
    },
    {
      "ordinal": 56,
      "problem_slug": "product-of-array-except-self"
    },
    {
      "ordinal": 57,
      "problem_slug": "remove-nth-node-from-end-of-list"
    },
    {
      "ordinal": 58,
      "problem_slug": "reorder-list"
    },
    {
      "ordinal": 59,
      "problem_slug": "rotate-image"
    },
    {
      "ordinal": 60,
      "problem_slug": "search-in-rotated-sorted-array"
    },
    {
      "ordinal": 61,
      "problem_slug": "set-matrix-zeroes"
    },
    {
      "ordinal": 62,
      "problem_slug": "spiral-matrix"
    },
    {
      "ordinal": 63,
      "problem_slug": "sum-of-two-integers"
    },
    {
      "ordinal": 64,
      "problem_slug": "top-k-frequent-elements"
    },
    {
      "ordinal": 65,
      "problem_slug": "unique-paths"
    },
    {
      "ordinal": 66,
      "problem_slug": "validate-binary-search-tree"
    },
    {
      "ordinal": 67,
      "problem_slug": "word-break"
    },
    {
      "ordinal": 68,
      "problem_slug": "word-search"
    },
    {
      "ordinal": 69,
      "problem_slug": "alien-dictionary"
    },
    {
      "ordinal": 70,
      "problem_slug": "binary-tree-maximum-path-sum"
    },
    {
      "ordinal": 71,
      "problem_slug": "find-median-from-data-stream"
    },
    {
      "ordinal": 72,
      "problem_slug": "merge-k-sorted-lists"
    },
    {
      "ordinal": 73,
      "problem_slug": "minimum-window-substring"
    },
    {
      "ordinal": 74,
      "problem_slug": "serialize-and-deserialize-binary-tree"
    },
    {
      "ordinal": 75,
      "problem_slug": "word-search-ii"
    }
  ]
}
