{
  "schema_version": 2,
  "id": "serverless-ci",
  "name": "Serverless CI",
  "description": "A focused ten-problem interview preparation set for serverless CI.",
  "members": [
    {
      "ordinal": 1,
      "problem_slug": "lru-cache"
    },
    {
      "ordinal": 2,
      "problem_slug": "course-schedule"
    },
    {
      "ordinal": 3,
      "problem_slug": "meeting-rooms-ii"
    },
    {
      "ordinal": 4,
      "problem_slug": "merge-intervals"
    },
    {
      "ordinal": 5,
      "problem_slug": "time-based-key-value-store"
    },
    {
      "ordinal": 6,
      "problem_slug": "top-k-frequent-elements"
    },
    {
      "ordinal": 7,
      "problem_slug": "number-of-islands"
    },
    {
      "ordinal": 8,
      "problem_slug": "sliding-window-maximum"
    },
    {
      "ordinal": 9,
      "problem_slug": "kth-largest-element-in-a-stream"
    },
    {
      "ordinal": 10,
      "problem_slug": "coin-change"
    }
  ]
}
